<?xml version="1.0" encoding="UTF-8" ?>
<pedido xmlns:xsi="http://www.w3.org/2001/XMLSchema-instance"
    xsi:noNamespaceSchemaLocation="EjercicioONCE.xsd">
    <tractor>
        <componente nombrefabricante="Ebro">
            <fechaentrega>
                <mes>2018</mes> <anio>2018</anio>
            </fechaentrega>
            <fragil/>
            <peso unidad="kg">12</peso>
            <numserie>00A</numserie>
        </componente>
        <componente nombrefabricante="Avia">
            <fechaentrega>
                <dia>12</dia><mes>1</mes><anio>2019</anio>
            </fechaentrega>
            <nofragil/>
            <peso unidad="g">1450</peso>
            <numserie>00D</numserie>
            <kmmaximos>25000</kmmaximos>
        </componente>
    </tractor>
    <tractor>
        <componente nombrefabricante="John Deere">
            <fragil/>
            <peso unidad="g">770</peso>
            <numserie>43Z</numserie>
        </componente>
    </tractor>
</pedido>